dvd player stuck ?  I know theres a way to click on something that says open but I cant find it .   My button wont let it open .   It seems stuck .   I know that you dont have to use knifes because I have done this before but my mind cannot remember what I did .  There is going to be a small hole near the eject button of your drive .  What you will want to do is strighten out a paperclip and insert it into this hole that will manually eject the disk .  ,4
what are the chances of getting into med school with a mcat of 15 ?  My husband just got his mcat score of 15 and is devastated .  His gpa is about a 3 . 5 .  He has already applied to about 30 schools all over the U . S .  and Mexico .  What are the chances of him being accepted ??  Unless he is african american hispanic or native american  not too good at least for US schools .  If he is willing to go to the Caribbean or Mexico then he will be fine .  Those schools arent too concerned about MCAT scores as long as you can afford the tuition .  Be sure he applies to Ross University  probably the best of the Caribbean schools . If he wants to stay in the US  better take the August test .  I would suggest taking a Princeton Review course .  ,3
Are we living inside an atom ?  if solar system and atoms have similar structure  then could it possible that we are living inside some atom .  As it has been proved that atom does not have any discreet boundaries bt the probability density of finding an electron decreases as we go away from nucleous .  and similarly solar system has no discreet boundaries .  And also the volume occupied by nucleous is very small as compared to the whole atom .... and same is the case of sun with respect to solar system .... there are many similarities like this ... So could it possible that we are living inside an atom ..? please dont try to prove me wrong ...... just think about it ..  Very good question ..... The universe mocks itself .  The sun does act somewhat like a nucleus the planets like electrons ..... you can transfer this idea to the galaxies also .  If we live in an atom ....... I actually am quite confident that we do . Its the only kind of theory that makes any sense . Its explains the big bang theory an eternal atomic level matter antimatter reaction that plays it little game until a new bang starts a new universe and so onIt also would help to understand the idea of infinite dimensions much better .   If we live in an atom then we are part of a system that is part of a bigger system that is part of a universe that is an atom ..... etc . You are really on to something here .  Remember that all and I mean every truly great scientist that ever was got the laugh .  Keep thinking about it . And as for the physicsengineer geeks .......... with your android minds ........ For the 30 years you have done nothing to advance the science ....... Instead of trying to build a better bolt try and invent something that disposes of the need of a bolt in the first place ..... Nuff said ,1
does it cost to play music videos on yahoo music ?  does it ?  Nope Im watching videos well really listening to them right now Just go through some of the artists in the lists and rate some music .  Then when you click to watch one music video it will play something else that you rated as I love it or I like it .  or it will play something in the same genre or popular music i listen and watch music and videos on yahoo all the time have a nice day  ,7
what is the maximum posibble 3 digit prime number ?  give hints ?  997 is correct .   Start at 999 and go backwards .   999 is divisible by 3998 is divisible by 2997 is prime because its not divisible by 235711131719232931 or 37 .   We only have to check up to 37 because 37  37  1369 which is bigger than a 3 digit number .   If a prime number bigger than 37 would divide into 997 then the quotient would be less than 37 and that quotient would divide 997 but we checked and no numbers less than 37 divide 997 do 997 is prime . That is known as the sieve of eratosthenes .  ,1
Today what good have you done for yourself and for others ?  I take care of sick old people 117 every night .  I take care of and love my husband and cat and sick elderly dog .   I help with my autistic grandson .   In doing for others I do for myself .   Is that enought ?  ,0
What are the points for ?  I really dont understand what we really need them for .  Ego .  Thats all . Though you suppoedly get some swanky stuff the higher your levels are .  And they let you participate more the higher you are .  ,6
Where did they find the passports of the highjackers on 911 ?  I know they found only one passport at the WTC . About the rest of the passports I have no idea  ...  ,9
in baseball how many runs do you score in a home run and is there any thing bigger than a home run to score ?  Well if you hit a home run it depends on how many people are already on base .   The highest you can get is a grand slam which is four runs .   Thats because theres a person on first second and third and then theres the batter which makes the fourth .   You can score by being batted in .   If theres a player on third and a batter hits a single making it to first base then most likely the runner on third will make it home to score one . EditSo it doesnt necessarily have to be a home run .   It can be a single double triple how many bases the batter can run without getting out or even a sacfly which is a sacrifice fly outball goes in air and is caught by a fielder but still scores someone .   Runners can run even if the ball is out if there is one or less outs ... 2 outs means that the batter can be third out and end the inning so nobody can run . Hope this helps ,5
Would a gay man be attracted to a female bodybuilder ?  Femal bodybuilders look more like men than women yeah but unless all them steroids they take have made them grow a penis i doubt they would be interested ,0
What is the traditional way to monogram someone who has a first name 2 middle names and last name ?  The traditional way for 3 names is first name initial is smaller last name initial is large middle name initial is smaller .   What is the proper monogram etiquette for a person who has 2 middle names ?   Do you leave out the 2nd middle name initial ?  This is a question that will come up more and more often when the new generation of younguns come of age .   I have a grandaughter with 2 middle names and a nephew with 3 middle names .   I could get on a soap box about the indicisive nature of young people these days but I will hold my tongue .   I think the traditional monogram is here to stay for now and it only allows for 3 letters .   Some folks will say choose the first middle name but it is my opinion that the person should be  able to choose hisher on monogram .   First name last name middle name of choice .   Of course there are a number of people who do not go by their first name at all .   That opens up a whole nuther can of worms  It is just a monogram .   Do what makes you happy .   No worries ,0
computer based information system ?  Definition features or characteristics ,4
how long do you think it will be before .....?  THE WORLD BLOWS UP ?  millions of years maybe ,1
actors that played sherlock homes ?  John BarrymoreBasil RathboneMichael CainePeter CushingChristopher LeeRoger MoorePeter OTooleChristopher Plummer ,7
Is President Bushs administration any better than Hamas ?  i think president bushs administration  is under pressure of israel zionists . hamas is making decision on its own and it has won the heart of the people of the region .  ,9
has anyone knows the full summaries of telenovela La Mujer En El Espejo ???  sorry i dont know the full summeries of this telenovela  .  but i would like to tell you the ending of this story is fantastic .  barbara will die and marcos will marry with juliana  .  they have twins  one boy and one girl ....  for more information please search the web that i give .  ,7
How do I start investing my money ?  Im 25 and I would like to start saving for retirement .   Does anyone know of a good firm that can guide me through this process ?  First pay off all short term debt .  If you have a credit card interest rate of say 21 thats an instant taxfree return of 21 per year on your money . Next if your company has a 401k with matching funds fund your 401k to the maximum match amount .  Free money is good . If your company doesnt have matching funds then fund your Roth IRA to its maximum 4000 .  Taxfree growth is good .  Id go with a noload low cost mutual fund company like Fidelity Vanguard or T Rowe Price .  If you have money left over after youve funded the 401k to the maximum match do this step with the extra money . If you still have more money for longterm investing go back to the 401k and invest in that up to what you can afford . And get yourself an elementary education in personal finance .  Youre going to get a lot advice here and you wont know who to believe .  Well you can believe this no one is going to care as much about your money as you are .  No one is going to watch it as closely as you are especially someone whos got multiple accounts to look after .  So get yourself a foundation so youll know if someone is actually giving you good advice or not .  Personally I recommend The Only Investment Guide Youll Ever Need by Andrew Tobias .  Itll give you an overview of everything you need to know stocks bonds real estate insurance etc ..  Then you can decide if you need a deeper education in anything .  Good luck ,6
Terrible smell after sex ?  Every time we have sex and he cums I alwasy get this bad odor and no matter how many times i douche it is still there even when we have sex at a later date it is like the smell is still in there deep .  What can i do to get rid of it for good .  GO to your gynocologist and first get yourself tested .  Also discuss what your are experiencing it might be the condom that you are using i hope .  See what she recommends .  LAdies when you go to bed with someone rememberLights on and eyes open .  Good Luck ,2
Men how does sex effect your glucose reading ?  Mine goes up 10 to 20 points .   Is that reasonable ?  I guess it could be possible that sex could increase your glucose ....  especially after ejaculation .   When you ejaculate there is a rush of epinephrine and norepinephrine adrenaline .   This causes your heart to race blood pressure to increase and also your liver to release glucose from glycogen .   I am assuming that you are a diabetic ...  for most people sex does not alter blood sugar at all because the body is very good at keeping blood sugar constant ...  that is unless you are a diabetic .  ,2
Does anyone else find it ironic that in all likelyhood a border wall will likely be built by illegals ?  I doubt that theres people out there right now building the thing and theyre doing it with their own sweat own moneybecause Bush the guy that cant say no wont say no mas to Mexico but in fairness the southern states are taking matters into their own hands and getting with the program too .  The sooner people quit bitching and start pitching in to actually solve the problems were currently having with Mexico the sooner we can go back to having an open border but not before .   ...  ,9
My father inlaw has Japanese MSWord are there any online tutorials that can help him ?  He is old .  He lives in Japan .  He strugles making Documents in Microsoft Word .  He has Office 2000 .  Well I dont understand Japanese but I think this Microsoft Website has training for office .   ,4
what is the best entry level nursing course to take  ?  a course that would lend me a job without much competiton and age restriction be it at hospitals or private clinics .  You have to complete a nursing program in order to be a nurse .   Your choice would be to be a registered nurse vs .  a practical nurse .   The difference is that registered nurses are higher up on the food chain so to speak .   They are allowed to do more than LPNs and are actually the immediate supervisors of LPNs .   For either career choice you have to complete a program of study .   For me I opted to get a Bachelors Degree in Nursing which is a 4 year college degree .   This is one pathway to become and RN .   You could also go through an associate degree course which is 2 years .   There are still some diploma nursing programs around which usually run through hospitals and are anywhere from 18 to 24 months in length .   For all 3 tracks you can take the boards to become a registered nurse .   LPNs usually go to school for less time however they also must complete a national board licensure before they can actually be a nurse .   Most of the programs where I live are around 12 to 18 months to become an LPN . The best program depends on what you want to do .   The hisgest entry level nurse is the Bachelors prepared nurse .   This option gives you the biggest knowledge base and your opportunities to advance typically are easier .   There are many diploma or associate degree RNs who progress very nicely though .   A big advantage of a Bachelors degree is that you can go on to graduate school to become a nurse practitioner or nurse anesthetist without having to go through the undergraduate classes .   If you arent interested in furthering your career then either of the other options are good .   Send me a private message if you have any other questioins .   I just went through all of this ,3
what would happened if a christian is dating a unbeliever  knowing she shouldnt ?  and lets say that christian is your daughter .  what to do ?  if she has feelings for the  guide and lets say he is a good student . who stays out of trouble . and then she says well god can change him if i pray about it .  do you think god can hear her prayers ?  Mixing of the faiths ?  Fire and brimstone rolls eyesOf course she should be allowed to date the nonChristian boy .  Love transcends doctrine and it does not come in limited supply ones love for God should not prevent one from loving another human being . The boy sounds like he is of good virtue anyway Christian virtue if you prefer even if he is not of Christian faith so I personally do not see any reason to forbid the two from dating each other .  ,0
formula to figure grade percentage in excel ?  AVERAGEnumerical gradepercent of total gradeAVERAGEnumerical gradepercent of total gradeAVERAGEnumerical gradepercent of total gradeAVERAGEnumerical gradepercent of total gradeSUMof all the aboveExample Exams 50 8451 ...... 33 . 75Labs 410101010101010 .... 4 . 00Lab Exam 6 82 .... 4 . 92Final 40 76 ... 30 . 40 Grade 73 . 07 ,1
its not fricken fair ?  i have 3 beautiful childrena boyfriend tht loves me very much .. a nice apartment with nice things ... in the past year i cant workcant drivei have panic attacksgo to the hospital for the wierdest things when i have an attack i have racing thoughts and bipolar ... i am 28 yrs old and this just happened .. why me i am a good person i dnt do bad things ... why do i have to deal with this ?  That sucks But no one can really answer your question except maybe your parents or grand parents had the same thing geneticsyeah it can suck big time .  ,2
When they first went to the north and south poles how did they know the exact position ?  No sat nav then How can sightings of the sun ect give a position acurate enough to plant the flag in the right snot .  They could have been way out and never got there ?  If you have a small compus as used by the early age sailors you will see the north is indicated at northen pole even if you make it rorate it will come back to its position again and show the north direction .  Once you reach the exact north pole then the compus will not work it will keep rotating as the magnetic lines will pass through and thus you will know that you are at exact north pole ....  and same is true for south pole as well  ...  hope I have answered your question ...   ,1
What do you think of Tom Cruise ?  I didnt really have a problem with him until he started mouthing off about Brooke Shields and her postpartum depression telling her it wasnt real .  Im not a Brooke Shields fan but has Tom Cruise ever given birth ?  ,7
is there a differance bettween useing common sense  thinking logically ?  One of the first signs of a mental breakdown is the inability to make decisions  ... Like deciding what is the difference between common sense and logical thinking .  ,2
If I accidently run over an undocumented permanent legal resident with my hummerdo they have a right to sue ?  For  mucho moola ?  There is no such thing as an undocumented permanent legal resident .   All permanent legal residents are documented .  ,9
what would your adult film name be ?  DZ NUTZ FANTASY THEATER FEATURING THE MECHANICAL BULL JACK GOT OFF P ,8
Help Any tips ?  I have a college interview on Friday and its my first interview ever Im so nervous I dont know what to expect .  Can you give me any tips any dos and donts ?  What will they as me ?  Is there any unmentioned dress code ?  When I go in do I have to shake their hand ?  As you can see I have no idea please help me I dont know what the questions will be as I dont know what the course is and probably wouldnt have a clue even if I did however interveiw tips I can do Do go in and shake their hands it is polite and confident .  Use good eye contact not overly much as that can seem agressive but make sure you look at them when answering questions  no eye contact at all looks deceitful or shifty .  Give yourself time to answer questions they are not going to mind if you take a couple of secs  to answer as it shows you are thinking about what you say not great long pauses a minute long though .  Make sure your voice is audible and clear  dont mumble or rush too much .  Dress smartly  as it is college I dont think you need to go the whole business suit type route but not jeans or sportswear  just something smart casual .  Do prepare beforehand  you wouldnt be applying if you didnt know a little something about the subject you want to study  so just make sure you read around it and have a think about your other interests outside the academic as well as that will show you to be a well rounded person .  And lastly  DONT PANIC  Stay calm and be yourselfI wish you all the luck in the world Im sure youll do great .  ,3
Will McAfee eliminate spyware already on my computer ?  I think I have spyware already I get these stupid popups about casinos sex partner finders even one that tries to download some bogus virus software etc ...  I tried some free spybot download I use it after each time Im online .  But when I get back on line I still get the popups .  I am wondering if I get McAfee will it get rid of all this and iwhich McAfee product to get ?  Do not run out and buy McAfee yet . Go to this windows site and follow the procedure using the programs the list .  This is your best bet for removing this .  This same procedure can be used with any AntiVirus or Antispy program .  Be sure to use the registry repair programs she lists after the removal .  is a package that protects me and my neighbor .  I havent been infected in 5 months and since I put it on his computer he hasnt been infected in 3 months .  He likes to download porn and it still protects him .  Best of all everything is Free and work as good and better than pay packages . Download the latest Java Update 7 .  Then remove any older versions from your computer .  here and download the following programs All will be in the first 3 red boxes .   If you have XP with SP2 then use the existing Windows firewall .  It is excellent .  If not then download Zone Alarm free version . AntiVirus program  If you have one then use it or replace it with one of these AVG 7 . 1 or AVASTAntiSpy programs Use more than one .  None can catch all the garbage out there Windows Defender Beta 2 Spybot Search and Destroy AdAware SE Personal . This program will work with the AV and AS programs and add an additional layer of protection and it really works great .   program will alert you to bad sites are my recommendation based on what protects me and my neighbor ,4
does John Cena have the champion chip belt ?  No EDGE SCREW HIM ,5
Best website to open a stock portfolio ?  I finally have money to invest but Im not sure what company I want to open it with .  Some offer a fee some dont .  Some offer more stock than others .  Is there a company with a cheap entrance fee that also has a vast list of tradable stocks ?  I would love to find a site that trades high performance stocks but ALSO trades penny stocks .  Serious answers only pleaseThanks I saw someone answer with a bunch of websites .  Some websites are good mind you .  But since you are dealing with the Internet you are going to get some serious information overload . Some offer more stock than others . Are you sure you know what you are doing ?  A stock is a stock and it only goes for one price .  No one can give discounts . I say who cares about the cheap entrance fee .  I see someone above referred to some cheap stuff go with that  but cheap entry fees to buy stocks should be the least of your worries .  I would love to find a site that trades high performance stocks but ALSO trades penny stocks .  If you are looking for a guru or a hot tip .  Forget it .  If things like that work those people wont be giving away their knowledge freely .  And if it were that easy we would all be doing it .  Keep reading and educating yourself and good luck ,6
Whats the easiest way to convert mp3 files in to wav ?  please help ?  If you already have WinAmp or MusicMatch Jukebox these both have builtin conversion functionality . If not Id use Goldwave .   It is shareware but if you are only doing this for a couple days you should be fine .   It also has a batch mode if you are doing more than one file at a time .  ,4
All middle school students please answer even high schoolers ?  Im going into middle school Im so scared lockers dances switching classes AAAAHHHH Youll be okay just switching class .   Have shorter amount of time to get to class . LC ,3
Do any Ivy League offer scholarships to foreign students  ?  What are the chances of getting such scholarships ?  My son has a brilliant academic record has moved from India to Singapore to do his A level on a Government of Singapore scholarship has over 100 hours of community service has published articles in the largest circulated English newspaper in India has been Vice President of the students council has been actively participating in debates etc .  He is looking forward to a course in liberal arts in the U . S .  He has already taken the SAT and is hoing to get about 2300 .  There are tons of scholarships that go unclaimed each year .  Many 400 500 or 1000 scholarships never even get applied for because people think its chump change and not worth applying for .  Well get a few of those 500 scholarships and itll really make a dent in your tuition bill . Do a search on scholarships search your major your ethnic heritage your town your parents employers your employer hobbies high school local chamber of commercerotary lions club etc .  Lefthanded ?  There is a scholarship out there for you Older woman returning to school ?  There are scholarships out there for you .  Do combined searches on more than one criteria hispanic women aviation scholarships etc . Go to the library and ask the reference librarian for a reference book on scholarships .  They usually have more than one .  There are all kinds of scholarships out there you just have to start applying yourself and make it your summer career to send out letters everyday for scholarships .  Good luck ,3
what should i do ?  ok i am 18 yrs old and so is the guy i am engaded to but i have a bad feeling of losing him .  he says i am not but i think i am we are so close and with everything that has happen from haters and our parnets i thought i would but didnt i should know by now our bond is strong but than why am i feeling i am losing him ??  what can i do to make it go away ?  If he says that you arent goin to lose him then listen to that Love is alot stronger than anything else in the world I kno wat u mean when people out there cause things to happen All I can say is listen to your heart bcuz in the end its alwayz right If you love your man then dont let anything get in your way Ignore those feelings bcuz that what they are Dont let them get in the way of your guys happiness ,8
why the transition metals have high melting point have high density and forming coloured ?  why theyre called as a collection of metal ?  Transition metals have high melting points because they are metals All metals have high melting points But some transition metals have exceptionally high melting points like Vanadium and Nickiel because they form a partially half filled 3d subshell for Vanadium and a fully filled 3d orbital for Nickiel which adds to an extra stability to the element .  Hence it is more difficult to remove the electron and thus result in the high melting point .  Since transition metals are all in the 4th period its Ar would be large too .  Since Ar is large naturally density would be high .  Because massno .  of molecules x Ar And density is defined as mass  volume .  The specialty of transition mentals is that the energy levels of the orbitals are close enough to overlap each other .  When electrons of a transition metal gains energy and is excited it is promoted to the 4s orbital .  However it is unstable at that level and soon drops back to the 3dorbital .  In order to return to the 3dorbital it must remove some of its energy and the energy is light .  That is why there are different colours in transition metals .  Because it only releases a specific amount of energy which relects different colours of light .  This process is also known as dd transition .  ,1
