determine the geometrical figure ?  what will be the geometrical figure of 3  5  122  2  121  2like 3  2  5  2  3 2 satisfies the conditions of making a right triangle . similarly any given number with any given power can be expressed as difference of infinite sets of two perfect squaresand the squares can be terminating decimals what will be the geometrical figures of such a case ? 6 You mean 32  52  42  ...  dimensionally this works .   For examples if the units are feet then you can take a bunch of one foot by one foot ceramic floor tiles and arrange them in a 5 by 5 square then take away a 4 by 4 square chunk of that and rearrange what remains into a 3 by 3 square of tiles .   Translated into inches you get 3122  5122  4122 if you have a whole lot of one inch by one inch tiles and you make a big 60 by 60 square out of then and remove a 48 by 48 subsquare then you can rearraqnge the remaining little tiles into a 36 by 36 square . Now consider 35  243  122  121122  121  122  1212 again in feet .   When you translate that into inches it doesnt scale the same way the left hand side is multiplied by 125 but the right hand side is only multiplied by 122 .   What kind of geometrical figure do you want to use given that it does not scale ?   Take a bunch of little one by one by one by one by one foot hypercubes and arrange them in five space  ...  then when you project along the  ...  the result looks like  ...   ???   ...  but subdivide each hypercube into 125 little one inch by  ...  hypercubes and what you just did no longer works .   Is that really what you are looking for ?  ,1
what is the best scholarship program for high school seniors ?  The Army college Fund .  In 4 years you can have 66000 for college not a loan and have a BA degree completed when you get out and training in the job you choose with management experience by teh age of 22 .  Anyone else offering you all of that ?  I also forgot enrollment in an Ivy League school university of Maryland and a job when you get out .  ,3
Anyone know of a weight lossenergy pill that works ?  I do and it truly works .   Not only am I eating less but I feel great all day long .   This product is awesome and I would recommend it to anyone and everyone .   A one pill a day keeps your appetite down boosts metabolism increases stamina and increases energy .   This is truly an amazing product I would like to share with the nation world .   It is an all natural ephedra free proprietary blend of ingredients that works for most people even if you do not work out .  Mexican LilyNo ephedra products arent gone anymore  the FDA lifted the banMy wife tried a product called Herbalean with 10mg of Ma Huang epehdra max allowed by the FDA and hoodia and she liked it so much she became a distributor . Herbalean is made by the same company the originally made MetaboLife 356 but their new formula wont give you the jitters .  It has hoodia for appetite suppression as well as 77 other minerals and herbs . ive been taking it for a few weeks now and feel fantastic .  I usually took me a big coffee to get me going but ive trimmed back on that and make it the whole day on a single Herbalean . Anyway check the links below for info on Herbalean and the recently lifted FDA ban on ephedra .  ,2
If Senator Hillary R .  Clinton were to run for the US Presidency today do you think shed win  ?  And why do you think so  ? Knowing where she stands on the current political issues would you vote for her  ?  And why  ?  Nope  Hillary would make a horrible horrible leader .   The US needs someone who can run the country not run it into the ground .   Though I really hope that she runs .   Afterall it could make McCains election the biggest landslide in American history ,9
Hail Mary ???  A Hail Mary is when you are on the other end of the field and you send all of you players running down the filed and you throw it to one of them praying that they catch it .  Well thats the best that i can explain it .  ,5
For those in FAVOR of open borders and granting amnesty what do you consider to be the best argument in your ?  in your favor ? If this question doesnt apply to you please answer my other question .  For me its an issue of human rights .  And no I am not a bleeding heart liberal .   I definately lean more to conservative . Yes they come here undocumented and inadvertently break the law .   For those who are just here to make a better life for there families I dont see why people see this as evil .   They had the misfortune of being born in a corrupt third world country not of their choosing .   We dont have a choice where we are born and to this I say live and let live .   A birthright for me is merely a gift of grace and see it as gift from God what make me so special that I deserve this birthright that I was born in this country ?   Nothing so I feel compassion for people who dont have this birthright or privilege and who am I to decide if they can or cant live here .   I know you must think that we as citizens must obey our laws to promote order and I agree with you .   However not all laws are reasonable and fair .   I dont really want open borders but for those who risk their lives coming here for a better life I say live and let live ...  ,9
Is the person of the master different from his teaching ?  Rarely can a teacher live up to the total message they are teaching . But hopefully the way he or she lives his life is also part of the lesson . With love in Christ .  ,0
can you give me a example of inelastic collision for physics ?  all collisions in enviorment are inelastic collisionsanyways one example is collision of two balls on table in airor anyother medium which can provide friction ,3
Why are Australias colors in the World Cup green and yellow and not the colors on their flag ?  Well I have read all the responses so far and I must say that some are very amusing but so far only one of these is close .   That is this one   the real answer is at the bottom please read on . Green and gold are the national colours of Australia as proclaimed by Sir Ninian Stephen the Governor General of Australia on 19 April 1984 .  The exact colours were specified as being Pantone Matching System numbers 116C and 348C .  Green and gold are also the traditional team colours of Australian national sporting teams .  Nearly every current Australian national sports teams wears The Green and Gold although the hues and proportions of the two colours may vary between teams and across eras .  It is widely believed that the colours were chosen because they are the dominant colours of Australias floral emblem the Golden Wattle . You will find that every major Australian national team wears green and gold including most notably the two time world champion Wallabies of Rugby the Socceroos of the World Cup and the Olympic team .  Sourceswikipedia . org  Real AnswerThe official colours of Australia are BLUE AND GOLD ...  Not Green and Gold Green and Yellow or any other colours of the rainbow or anything else that the so called greenies or hippies or even other minority group may wish to conjure up .   If you go to Parliment House and read the constitution  not that many of obviously have or have the ability to you will find amongst the small print that the national colours for the reprsentaion of this great land of ours called Australia are Blue and Gold ...  the reason that we portray Green and Gold is for our sporting teams and that is due to the above mentioned clours of the Wattle flower and tree .  Now before you so called experts try to smack me down with all your references and alke I suggest you visit the National Capitol and see the constitution for yourself .  Also take the time to read it if your able to that is  and you will no doubt see that I am correct and you are misinformed ..  I hope that this had shed a bit of light on your dilemma or at least given more ammunition for a good arguement as I really do enjoy that ..  ,5
Do you think playing soccer in other leagues around the world helps a player on National duty ?  Americas goalkeeper Kasey Keller plays in Germany .  Do you think that would help him or his team be better prepeared for the World cup ?  Like the previous answer has clarified most of the Brasilians players play outside Brasil .  And that is the same for Argentina Ghana and many other teams .  Without doubts playing outside their owns countries is beneficiary for many players included in their National Teams but it is not that decisive .  ,5
what is oxydrene  how is it made ?  Oxydrene is one of the most important bodybuilding developments  . Ingredients A Proprietary Blend     Sedum Crenulata root     Hippophae fruit     Fructus Lychii Chinensis ,2
I may be falling in love with a married man .?  I may be falling for a married man .   I know it is wrong and we started out as friends .  We have been friends for a long time .  We just started spending more time together .  We have both been going through rough times and depend on each other as someone to confide in .  I do not want to break up his marrage but in his eyes the marrage was is trouble long before we started spending more time together .  He is miserable but will not leave because of his daughter .  He lives child .  I do nto blame him but I can not help the way I feel .  I find my self thinking about him all the time and worring if he is okay .  He is affectionate with me when I see him most of the time but we also work together so it is kept so quiet .  I do not know what to do .  Please help ?  okay check out my profile on the questions asked section .   i know the feeling .   however in my situation we have crossed that line over 2 years ago .   As for being my Best friend He has been my best friend for 6 years .   It doesnt start off as oh yea i am want to steal this man from his wife or visa versa .   It is a connection .   You will receive judgment like I did But not from me .   If you ever need to talk feel free to email me  ammutdevourcomcast . net .   i read your other asked question .   please email i might be able to give you advice .  consequences benefits etc .  ,8
Microsoft Office 2003 question ?  I have microsoft office 2003 and i want to set it so when i minimize it  it goes to the taskbar by the clock ..  I had this done before but cannot remember how .  With Outlook 2003 and Windows XP the icon automatically appears in the Notification Area used to be called the System Tray .  Just rightclick on the small icon and choose Hide when Minimized to eliminate Outlook from the regular taskbar . Other applications can be sent there with an application named Actual Title Buttons .  It cost  19 . 95 but a 60 day trial can be downloaded from ,4
How can I contact Bobby Deen ?  OK Im a little addicted to The Food Network .  Paula Deen has a cooking show she is a sweet woman from GA and she cooks southern homestyle foods .  On occassion her boys join her on the show both are quite handsome .  Well PEOPLE magazine just listed Bobby Deen as one of their top Bachelors .  So I was wondering ... does anybody know how I can contact him bobbys the shorter son right ?  the one with the darker hair ?  oh hes sooo cuteeeeeee love his cleft chin and muscular arms oh my get in line girl i want him toolol  write him at his restaurantbobby deen  coThe Lady and Sons102 W Congress StSavannah GA 31401 or call him1 . 912 . 233 . 2600   restaurant phone numberboth sons are gonig to have their own show on the food network starting in july ...  ,7
how do you prove existance of God Scientifically ?  Scientifically PLEASE Not possible .   Not required .  ,0
Does CNN have an agenda ?  Does CNN lose some credibility when it titles its story Fatalities Up 67 Since Motorcycle Helmet Law Repealed But only briefly mention that during that same time motorcycle registrations were up 87 causing a net DECREASE in fatalities  deep in the story ?  Everyone has an agenda .  Dont you have an agenda for pointing this fact out ?  ,9
What is a good interview questiontechnique to pick out the Excuses Ellys beforehand ?  Theres one in every office they perform spectacular in the interview have an impressive resume but when it comes to real work they suddenly have a billion excuses why they cant produce the rd wont give me the necessary info marketing departments not cooperating they didnt give me blah blah blah its their fault their fault their fault .   Short of a personality test what are some good questionstechniques that help you weed out these excuses people during the interview process ?  first of all .... are you calling all of their former employees to ask about previous preformance ?   Second are you as an employer bringing enough training and mentoring to the program ?   If not the company needs to evaluate how to add more training .... my company provides training on various topics every single Thursday morning .   Pretty awesome for a company of less than 30 .   Third test different selling scenarios during the interview .... maybe do a round of interviews and then out of the top five candidates call them back and set up a selling scenario ,6
Where do you download music and video from  ?  i need a p2p thing or sites where i can get some good darkwave gothic and electronic music .  i just cant find it in warez or morpheus .  peferably those p2p networks of europe .  I go towww . mp3000 . net or www . mp3int . com ,7
please tell some wap sites for good xxx 3gp clips under 400 kb ?   ,4
I am moving to San Francisco CA .   My budget is 1300mo .   I want 1bdr near BART and safe .   Recommendations ?  I recommend the east bay near the bart stations .  I used to live in El Cerrito and the neighborhood is very nice .  The only thing is that was over 5 years ago I am sure prices are up but you should be able to find something reasonable around there .  Good luck ,6
Is it possible to find love on yahoo answers ?  Im thinking outside of the box here .  Basically Im looking for interesting and unique people to talk with .  The craze these days is myspace and facebook maybe this will be the next revolution .  Hope to hear from single females .  probably cuz people arent always who you think they are .  hope you find somebody .  ,8
Will someone please teach me Czech online ?  Please We can even email or something ...  Will be my pleasure .  I am currently teaching my fiance so he can communicate with my family .  ,0
            Mind Control  Electronic Harassments            ?  Have you heard or read about the new undergroundgovernment called New World Order ?  New World Order has the ability to alter all elections by Mind Control and by all means has increased dictatorship among everyday American citizens and can implement an early but appears normal death . New Word Order .... Vigilante Citizen Stalking GangsKnowledge is Power ....... 1  www . catch . ca2    www . raven1 . net4  www . multistalkervictims . org5    www . psychologicalharassment . netfirms . com7    www . gangstalking . org9  www . mindcontrolforums . com10  Terrorist Stalking America Just trust in God we already know who will win .  ,9
Biotechnology  an exciting new job oppurtunity or a legislative time bomb ?  What are your thoughts .?  Its a relatively new field but is it really going to last despite all its potential ?  I hope so since I have a Bachleors in Biotechnology .  Right now the job market is very good but like Stephanie said science jobs pay very little I know that better than anybody .   In regards to if it will last that depends on what field of biotechnology you are refering to .  From the way you worded your question I am assuming you are talking about the more controversial areas and Id have to say since this country is so conservative that will probably continue to stand in the way of our advancement in the scientific field .  This is unfortunate because we will probably find the U . S .  falling behind the rest of the world in this aspect .  ,1
Try to make me laugh ?  try to make me laugh and youll get 10 points just answer those questions1 .  what is the most funny question youve ever found on yahoo answers ? 2 .  what is the most ridiculous phobia out there . 3 .  what is the most stupid celeb . baby name ? 4 .  tell me a joke5 .  youre done 1 .  Can you get pregnant from swallowing sperm ?  2 .  Being afraid of peachesthe maury show .  3 .  Apple . Gweneth Paltrow that would be like naming your baby banana or orange .  4 .  Im not good at telling jokes but im so cute people laugh anyway .  5 .  Im done ,7
Am I the only girl who thinks diets can only be started on a Monday ?  I always start great and fall off the wagon by Wednesday and then say ah well I will start again on Monday .   It cracks my partner up he always asks why can u only start your diet on a Monday lol .  you know what i think exactly the same i thought i was the only crackpot who did this but in reality i think it is just an exuse to pig out till monday and say oh sod it i will just have this ONE LAST takeawaychocolate cake and i will start a fresh week on monday it never happens though does it i go on about 4 diets every month LOL you only have to say the wodr diet and i am hungry and you know what they say the first three letters of diet are DIE ............  ,2
What did you learn about Leonardo Da Vinci that you did not know before after the Da Vinci COde ?  Well Id say that I didnt learn allot directly from the book .   Most of the stuff that I learned about him were from the countless documentaries that saturated the education channels during the controversy of the Da Vinci Code .   I learned that he was an outcast due to the fact that his parents were from two classes of society and therefore forbidden to marry .   I learned that although the church contracted him to paint many paintings he never quite gave them exactly what they wanted and he was asked to repaint at least one of his paintings .   He was brilliant .   Much more intelligent than I ever thought .   He was truly a Renascence man .  ,0
Whats with all the question that are like personal adds ????  It seems no more than before the single and dating QUESTION AREA on Answers instead of say MYSPACE or YAHOO PERSONALS ? Why is that ?   Just want to hear people opinions .   Thanks i agree single man looking for a mate in the suburbs  . is not really a valid question . do you want to buy my car . oopsi repair moon mobiles on the dark side of the moon sorrybut seriously i am single and live in Antarctica any Eskimo maidens want to migratedam but i do know what you mean and there are a lot of other type questions that are more like anouncements or questions that just say banana or brother or sisterand we have to figure out the rest of the question  . please people if you cannot think of a question this is not a sin save the five points and answer a few give some input with your opinion instead . or is this to much to ask anybody has a female crocodile for my male ?????? believe it or not that is for real ,8
can someone help me ?  i just got asked out by this totely hidious guy but the problem is hes really nice but i dont like em how do i tell him no without completely crushing him Oh thanks for asking but I dont have the same feelings for you .   Its very sweet of you to ask but no . Do this privately and never discuss it with your friends or anyone else .   What is crushing to boys is the humiliation of girls talking about them and saying things like eww gross he asked me out but I wouldnt touch him with a tenfoot pole etc . Just have a little respect for both him and yourself and youll be fine .   Remember that you are helping him to learn that life goes on after disappointments which is critical to building confidence .  ,8
Do you think these are working ?  The folowing link shows baby dolls made of silicon ruber . mainly in Japan men are buying it . do you think are these dolse are working for sex ? is it really enjoyable naturally or what ?  HOTi so want one ,8
your most embarrasing moments ?  id like to knoe Ive had so many its hard to pick one out .  ,7
who is the hottest diva in wwe divas ?  Ashley Trish and Maria ,5
Why is it that men say they are going to do something and then dont do it ?  Maybe I get my hopes up to easily or am too trusting but when someone says theyre going to do something I wish they would do it .  I also know that it isnt just men that do this .  Women do the same thing .  they arent very assertive and believe people wont like them if they stand their ground .  I use to have a similar problem but over time decided to say no when I wanted to .  it works better to just say no than to string people along .  you cant make everyone happy .  ,8
Who enjoyed last nights Raw  with hilarious DX ?????  I absolutely enjoyed itand I thought the jokes were hilarious and a great DX reunion . They even told Shane Stephanie is in a labor I loved the Monday night raw and the best raw in a long time .  I love the spirit squad getting green slim and then they get it again at the end with the little men moon them with stick it .  It was so great I laugh for awhile . A man head through a wall . DX is back and loved it .  ,5
what is the byzantine catholic rite church ?  I am a roman catholic .  I walked in to a byzantine catholic church by mistake and thought it was a catholic one because of its similariity from the outside and the chants .  Everything was going ok except that the priest was on his back but i thought what the hell ?  they did this a long time ago anyways ...  and then  At the time of communion the priest got a spoon and fed everyone a spoonfull of something that tasted like fruitpie and wine ..  what was that ?  I couldnt get out of the line so i had to take te spoonfull ..  lol what was it ?  what are the differences between roman catholics and byzantine catholics ?  why does the priest give mass on his back ?  please help me understand where i went and what i tasted  thanks You were most likely attending a Catholic Mass in an Eastern Rite Byzantine Catholic Church which is probably fully in union with the Holy See at the Vatican but using a different liturgy than western Roman Catholics are used to .   You should have just stayed around after Mass and asked these questions to the priest .  You likely received both the body and the blood of Christ at the same time rather than separately .  There are many more details to share .  For more post your questions at www . askmeaboutgod . org and receive a free private complete personalized answer via email in about one day .  Doug ,0
Who saw the Da Vinci Code ?  If you read the book before you saw the movie did you still enjoy it ?  Though I read the book first I felt the same excitement chilling down my backbone .  Everyone have acted reasonably good ,7
does anyone like to swim at the pool ??  Ive done a lot of things at the poolhall  but  swimming isnt one of them .  You might want to put this question in a different category ?  ,5
When we colonise the moon will the pubs have any atmosphere ?  lmao cute .  ,1
Does anyone out there like using sex dolls ?   Does it work do you really get enjoyment out of them ?  I want an alternative to a girlfriend and prostitutes are too damn expensive .   Any thoughts ?  stop worrying about sex .  ,8
How to hide my ID when sending aSMS message to a cell phone from my computer on yahoo messenger ?  I dont think that you can ,8
Is there any way to get rid of REALLY bad eyesight ?  plz help I got this in an email from a friend and although I do not have vision problems myself I read through their information .   It sounds very logical and I even recommended it to my dad .   It may be worth looking into .    Good Luck .               ,2
Dont you think that England is the CHAMPION  ???  Im quit sure that the final game would be  England  Brazil and then thats England who win the cup With David Beckham we shouldnt be afraid of any other  Hes the real LION  David B .  is soo hot even men love him .  I will route for England and US equally .  ,5
Who scored in the 1958 World Cup match btw Northern Ireland and Czechoslovakia ?  Name of player please .  First or second half ?  Got any more details ?  Perhaps a URL ?  08 . 06 . 58  19 . 00 Halmstad rjans VallNorthern Ireland 1  Czechoslovakia 0 goal Wilbur W .  Cush 20Northern Ireland Gregg Keith McMichael Blanchflower c  Cunningham Peacock Bingham Cush Dougan McIlroy McParlandCzechoslovakia Doleji Mrz Novk c Pluskal adek Masopust Hovorka Dvoak Borovika Hertl Kraus ,5
how do I add music to my 360 blog ?  I use a mac not a pc erm didnt know u can ,4
if a guy with a std haves sex with a girl with a condom on will it help the girl from not getting the std ?  It will help but it is not 100 effective .  ,2
How many kilometers is the Olympic cycling size oval  ?  I think you mean the banked track  a velodromeThe length varies .  Most are either 250 meters  . 25 kilometer or 333 meters .   Some are as short as 125 meters some as long as 500 meters . If youre talking about the road course it varies with each Olympics .  In Athens I think it was about 15k per lap for a total of over 200k in the race from memory .  ,5
when is the undertaker returning to smackdown ?  I want to know when the undertaker is set to return to smackdown and is it true he wants to go to RAW ?  I hope not he is the best one on smackdown ?  What has he been doing on his time off ?  I know his wife had a baby on his last big break .  hes not goin anywhere .. i think hes tryin to be out first until The Great Khali gets involved in somehow a wwe match then he will make his appearence to scare him or to attack him from the back ..  ,5
