if chickens are comes from eggsand eggs lays by chickens then who came first in the world ?  ,7
if u try to fail and succeedwhat have u done ?  can vegetarians eat animal crackers ?  why do they sterilize needles for lethal injections ?  First question simply put you have succeeded at failing .  It would still be a failure to those around you but you could silently applaud yourself for a job well failed .  Second I know a vegetarian that wont eat them just because they are called animal crackers her sister is a vegan and wont eat them because most are made with egg or milk product .  I would look at the ingredients and if they have animal byproducts that you wont eat then dont buy em .. Unless thier for me ...  because I will bite all thier little heads off and then eat a steak ...  Now this third one is a little different .  You ask why they would sterilize them and I asked my mother who is a nurse what she thought about it ..  She simply put me in this situation .   If your about to give lethal drugs to someone and lets say you used a dirty needle .  I said yeah ... so And what happens if you slip and the needle goes into your arm ?  I said It would never happen but yeah good point .  So I would have to say that if you are using a needle even if its not for your arm ...  you wouldnt want to be on the wrong end of something that isnt sterilized .  Trust me its not for the safety of the inmate about to be put down ....  Its for the safety of the nurse givin the shot . Hope this clarifies anything your still asking yourself .  Thanks for letting me respond .  ,3
Draw a picture that shows hydrogen bonding between H2O and NH3 .?  HOH  .....  HNHHKEY ........ hbond  sp3 sigma bond cnat remamber if this is accurate ...    ignore this .  i used it to push the H under the N ... note the  H2O has a slight bend like a boomerang due to the 2 lone pairs of electrons on O .   and the branching in NH3 has a flat tripod like shapeps please refrain from asking people to draw things here its very difficult ...  Good thing i have patience ... Your Welcome ...  ,3
in basketball whats a suicide ?  is it like running back and forth ?  Its an exercise where you run the entire court touching down in intnervals until youve completed the exercise on both sides of the court .  ,5
Would changing my first name affect major parts of my life ?  I want to change my first name from Corie to Corianne .   Its more feminine and professional .   But my parents think if I change my name it will affect my credit college transcripts etc .   They said it would be hard in the future to get a job or a loan because changing your first name makes you look suspicious .   Is this true ?   I really want to go through with it but not if its going to be a huge hassle .  LOL I changed my whole name once completely different .  I even eliminated my middle name entirely .  All it takes here in my county is 75 . 00 and an appearance in a small claims court .  You answer a few questions such as why you are changing your name if you are doing so to evade creditors which the answer has to be no etc .  After the judge grants you the change you have to send in for a change on your birth certificate social security card and whatever else .  It is really easy and for such a small change as yours it will be even easier .  Very few applications ask whether you have ever gone by another name .  I work in healthcare so I had to disclose my other name once but that was it .  You know what ?  I changed my name back a year later .  I just decided to go back to my original name and it was even easier than the first change .  Hopefully it is the same in your area but laws do sometimes differ .  ,9
can anyone give info on underwater monlith off W . A .?  I was not able to get a definitive answer on this but I found thisIf youre heading out to Avon Valley be sure to see the stupendous Wave Rock a monolith shaped like a giant wave .  1330 mi2140 km southwest of Alice Springs . Perhaps this is what youre talking about .  ,3
Starting a GSA in my high school ...?  I would love to start a GayStraight Alliance at my school but I need a teacher sponsor and I just dont know where I could begin to ask .   Also I am out to all my friends but none of my family and do you think this is a worthwhile endeavor considering that I know now is not the time to tell them gearing up for senior year is stressful enough ...  I know if not now when but I will I just dont want to rush it ?   Would it even be worth the trouble ?  I would check out what they have on the GLSEN website they have a whole student section with stuff about how to start a GSA be helpful .  As for asking teachers I would try to find the most liberal one you can think of .   I would look for a teacher who is 1 under 35 2 teachers something not math computers or science look at music psych social studies librarians or sex ed teaches  3 if you cant think of someone talk to your principal or vice principal whomever is in charge of student activities and ask for suggstions 4 and just scew up your courage and ask .   Pitch it as you want to form this club to combat bullying and antigay harassment and give support to fellow gay students as well as build bridges between gay and straight people .   Yes someone might turn you down .   Yes they might get all uncomfortable and weird and turn you down .   But you know what thats life kiddo .   People are going to turn you down people are going to treat you like a freak because you are gay some people are going to be down right bitchy about it .   But that is exactly why you need a GSA  because it is rough to be gay .   If you cave now youll spend the rest of your life feeling like a dumbshit for not just going through with it .   Some rejection from a teacher who you will never see again after graduation is not going to ruin your life .   And you shouldnt be embarassed becuase some people are phobes .   If some teacher turns you down they are the ones who should be embarassed  and you should make them feel as such . If they turn you down just lay on the old guilt .   Say that youre sorry that they are not more willing to be accepting and supporting of diversity in the student body and say that you are really disapointed that you will not be getting their support because it is so necessary for teachers to take a stand and lend authority to antibullying efforts .   Youve got nothing to feel bad about because some people are cowards freaks and phobes .  ,0
Why would God create the dinosaurs only to kill them off ?  Is He imperfect ?  Im glad theyre gone .   Can you imagine driving around town today with a dinosaur roaming around ?   I hate dodging SUVs like Hummers just imagine dodging a Brontosaurus Fossil fuel thats a reason we needed them to die we have oil deposits from them . Everything happens for a reason dont forget that .  ,0
why do you men cheating when you already know you have something good ?  There are two or three kinds of cheaters .  The worst kind and I know several are the immature selfish type who seem to need to prove to themselves over and over that they still have it or somehting like that .  Then there is the guy who loses it once or twice .  Men who travel a lot and women get very lonely at night .  Hard to describe but Ive been there .  The porn industry makes a killing by selling all kinds of adult programs to hotel travellers .  They really miss home  ...  the wrong situation the wrong time perhaps there was an angry exchange with the wife  ...  some hot babe walks into the bar and sits next to him  ...  it happens .  The third kind is the guy or woman who has been in a loveless marriage for years .  There is a nice house kids community life and all kinds of great things that came from the marriage .  But somewhere along the way the romance died .  Husbands and wives spend so much time battling over emotional territory work so hard to get what they want out of the marriage  ...  lots of wives offer sex as a reward for good behavior .  It seems to work so well that they never give it away for free lest they lose that leverage .  Husbands may in turn stop doing anything unless they get a reward for it .  Sick I know but those of you whove been married for a long while know what Im talking about .  The husband or wife who cheats on that marriage is usually desperate for genuine intimacy .  Love that doesnt require a high score on the report card .  The women who use the vagina as a wrench arent terribly happy either and are just as likely to be seduced into the cheat . It is a sad state of affairs .  Unfortunately the young immature guy or gal who cheats early on for selfish reasons pretty much destroys the trust needed to find real intimacy .  He or she will wind up at an early age in the third kind of loveless marriage .  The key I think is to never use sex for leverage .  Never It is a shared intimacy that only the two can share .  If you want a new car or tennis bracelet just ask .  Amaze him with your passion and give him a place of emotional refuge at home .  He will be so grateful that hell bring home gifts on his own .  Those are the best kind .  ,8
Help with myspace . com backgrounds and stuff ?  I just joined the myspcae . com and was wondering if anyone could help me get my page up and working .  I cant figure out how to set the background on my page like everyone is doing .  It would really help if someone could talk me through it .  If possible try IMing me at chucksangelinpink on the yahoo messenger ?   this is one website check it out and Id be happy to talk you throught it if you find something you like on there if not I will help you find more sites its really fun to desing them ,4
what is LC means in a overseas business imports  exports ?  Letters of Credit a commercial letter of credit issued by a bank on behalf of the importer .   In the document the bank agrees to honor a draft drawn on the importer provided the bill of lading and other details are in order .   In essence the bank substitutes its credit for that of the importer .  Obviously the local bank will not issue a letter of credit unless it feels the importer is creditworthy and will pay the draft . The letter of credit arrangement almost eliminates the exporters risk in selling goods to an unknown importer in another country .  ,6
why iam al ways thinking negtively  if want o do some works then first comes in my mind negetive things why ?  hy iam al ways thinking negtively  if want o do some works then first comes in my mind negetive things why if i go for any work first in my mind negitive things only  .  i keep on thinking about negetive things only its comes in chilwood to till noe iam 25 year now so what to do for postive thinks I cant really tell what you are asking ... Are you saying that you dont want to work or .... Ok as far as negative thinking A wise woman once told me Never let a negative thought stay in your mind for more than 3 minutes .   So the next time you find yourself thinking negatively you need to become aware aka selfaware and put a STOP to it .   You are the only one that can controll you and your thoughts .   So if you HONESTLY want to put a stop to it you need to use will power and just Stop what it is that you are doing .   As for work ... Youre NEVER going to become successful if you have a negative attitude .   People dont like hanging around negative people .   No one is going to want to be around you if you bring them down .   So if you want to be successful win friends and influence people you must become the person that you youself would like to be around .  Only you have the power to change .   Next time you find yourself thinking negatively look at you watch give yourself 3 minutes and get over itGood Luck ,2
I have a Cannon 560s printer that I need to get a download for to put it on my computer  but I cnt find one I went to Cannons websight  but can not find the download for my printer I have never heard of a 560sthere is a 560i and canon . com does have a driver for it under the downloads section .  ,4
Would my girlfriend break up with me if she found out Im atheist ?  Shes christian but not that religious if she loves you she woudlnt ,0
Should I be angry with my husband ?  We have been married for almost 2 years and together almost 4 .   I grew up an only child and very independent .  My husband claims to be independent but his mother is very controling and ALWAYS did things for both the boys especially him since he was the youngest of the two .   So his independence is nothing like mine .  I love him dearly but he constantly involves his mother in our financial status and asks her for help when we need it .  I understand that being young and married and in school can be hard but I just want both of us to have control over our lives .  When she gets involved all control goes to her and my husband and I fight about that .   He thinks that there is nothing wrong with it but I feel like I am just his roomate who happens to share a bank account .  I hate getting mad at him but not talking to me about and involving his mother does not help .  I am all about communication .  We are both 23 and I feel that we should be dependent only on each other .  Am I wrong for being upse No you are not wrong to be upset  Those are your feelings ,8
Did she really steal ?  One of my best friends has been staying at my house for over three months now because she got kicked out of her home .  We share the same room and all and technically she is allowed to borrow my stuff but she usually asks .  Except this one time .  I had just bought this skirt and never worn it .  I came up one day trying to find it and asked my family if theyve seen it .  They said she had left with it .  Heres the thing when someone confronted her about it her excuse was that it was a joke .  Its been a week and she never gave it back .  I havent really seen her around because shes been at her bf and all .  Alot of people have been telling me she stole .  And that the joke part was really just a coverup because i tend to forgive easily .  Many of my friends said youre too nice and naive you let people walk all over you and you cant get mad when you should be bad .  Is it possible that she might have stole and lied to me ?  What am I suppose to do ?  Just a joke often means somebody covering themselves .  In this case it doesnt sound like a joke .   But covering themselves doesnt necessarily mean she stole it .   She may have felt that she had your permission to borrow things as you implied .   So if somebody confronted her about something she borrowed her automatic response may well have been to become defensive and conver herself .   Im a little confused about her not returning though .   You share a bedroom .   Do you share dressers and closets ?   If she has her own set of clothes and stores it there why not just take it back ?   Surely she hasnt been WEARING it for the past two weeks .   Talk to her about it but dont accuse her .   If she felt she was allowed to borrow your stuff freely its not fair to accuse her of stealing simply because you hadnt worn the skirt yet especially if she didnt know it was brand new or special . Good luck .  ,8
where can i find a video of kyle farnsworth fighting paul wilson from 2003 ?  I dont know about a video but you can find some pics of the brawl below  .  ,5
when Im trying too lose 30lbs which diet should i go with ?  exercise is a must .  you cant drop that kind of weight quickly by diet without harming yourself . eat 6 very small meals a day .  this will get your metabolism up ,2
help ?  can anybody tell me y cant i enter any chat rooms this request was refused any body tell me y i chat everyday and if there is a problem with my server can it get fixed ???  ,7
how to make more money ?  Online  ?  Some easy money  ?  ,6
If youre a girl and youre a liberal dont you get tired of being tools ?  Just a thought .  If you are a douchebag that makes stupid generalizations based on gender and political affiliation dont you get tired of being a judgemental moron ? Tell me about your frontal lobotomy ...  was it any fun ?  ,9
Do you think the suns will be better then ever next season with Amare back ?  I think they could win it I hope .  they did great without him for most of the season .  how could amare not make them better ?  go suns ,5
I know Im Prego .  but I have had my period for some time now What does this mean ?????  I had a very light period for a week and thought I was going to luck out this month .   I was about three or four days late for this period and when I got it I was very light .   I found something alarming to say the least and took a pregnancy test and it showed that I am in fact prego  I went to the hospital they did a Sono and could not find anything in my Uterus .   My Betta s are very low around 380 I think  If it is so early in a pregnancy could you see anything anyway ?????   I need to know if you would be able to see the pregnancy through a Sono when Betta s are around 380s ???????  See a doctor ASAP . Home preg tests can be wrong you might have a sexually transmitted infection that is fooling the results .  Or you might have an ectopic pregnancy which means that the embryo has lodged in the tubes and not the uterus .  Left untreated this can be fatal .  You need to see a doctor .  NOW ,2
what is the most outrageous thing you have ever done ?  I went to 6 parties in 3 states in 11 hours ,0
Who you think will win USA vs GHANA ?  Usa vs Ghana no offense but i predict a 20 win by usa or a 21 win by usa .  damn USA must win ,5
how do i make an mp3 to an http mp3 ?  to put music on my site it needs to have http at beg abd mp3 at end .?  ,4
what are some good ways to loose weight ?  With out alot of trouble .?  I want to loose at least 10 pounds .  not for any reason just to feel a bit better thats all .  i am wondering the sam e thing  ,2
have u ever had scoliosis surgery if so tell me all about it please ?  im having major back surgery this october due to severe scoliosis and im DESPERATE to know as much informaton as possible so if youve ever had this type of surgery can you pleeeeeeeeeeease tell me all about your experience ? thank you bunches well i am going to try .  i didnt have back surgery but i had major chest surgery .  the results are still the same though .  you cannot walk for a long time and you cant move your head .  I hpe that your surgey will go well . But do not worry i am going to be praying for you and have the rest of my church praying too .  ,2
When will the moon lose orbit from earth ascend away into space ?  The moons orbit is not permanent in what year range will the moon break orbit and become a planet with its own solar orbit .  The moon will not escape Earth orbit .  It is currently moving away from us at only 38 mmyear due to energy transferred by tidal forces .  The energy transfer is also causing Earths day to become longer currently it is increasing by 15 microseconds each year . Theoretically the moons orbit would increase until the Earths day slows to match the Moons orbital period .  After this point solar tides will dominate and the Moon will start moving closer to Earth . Before this happens the Sun will become a red giant 5 billion years from now .  ,1
Whats an easy way to visualize the 4th dimension ?  From what I remember in geometry class the 4th dimension was simply time .   And just like the other three length width and height it can be measured in various forms  seconds minutes hours etc ..  ,1
nursing management for any fever ?  check the temperature 1st . if the temperature is below 38 deg apply cold compress on various areas such as the forehead armpoint groinif temperature is above 38 deg do tepid sponging .  n PLZ USE TAP WATER .  sponge the patient for about 10mins stop when the patient is shivering and place towels on the various areas that ive mentioned above .  ,1
How can we get the 2 political parties to focus on what our country and earth need and not party interests ?  I am concerned that our 2 political parties focus almost exclusively on their party lines and their party interests to the exclusion of a focus on what needs to be addressed in our country and the earth .  How can we help them refocus their energies where it can do the most good .  We have significant issues facing us as a nation war hunger poverty polution the economy .  Worrying about how to win seats in congress and how to spin bad news and how best to berate the other party doesnt help any of these issues get addressed .  start another party that does focus on the real issues and somebody has . www . unity08 . com ,9
where does the saying send you to coventry come from ?  when someone says ill send you to coventry and they then egnor that person how did that saying come about ?  The saying came around in the 1700s alright but  this is a more accurate view of it .   Bham was always a bigger district and coventry was always a dump so when anyone got into trouble with the law they were sent to work in the dump known as coventry .  It then ended up housing thousands or retards and this is the way it still is today ,3
can anybody recall or find an old rocksad song from another era ?  THE SONG IS GOES LIKE THIS OH I DONT KNOW HOW TO SAY IM LEAVING . ITS CALLED IM LEAVING BY TAXXI AND IT CAME OUT BETWEEN 19791982 SOMEWHERE AROUND THERE IN THE US .  IS THERE ANYBODY ON THIS PLANET THAT CAN EVEN RECALL THIS .  THE ALBUM WAS BLUE THE LETTERS WERE WHITE AND THE SONG ROCKED try rolling stones mags website ...  rollingstones . com ,7
Could be classify violent illegals as enemy combatants ?  Violent illegals dont care about getting deported so they just smirk their way back to mexico change their name and return .  What if we created a Guantanamo type of island prison for violent illegals ?  Sneaking into someone elses country and killing a legal citizen seems like an act of war to me .  I think in addition to helping mexico build things like schools and roads we should also help them build prisons because they dont seem to be able to keep a handle on their own criminals .  Americas not the worlds dumping ground and the people that come to the US and screw up are often screwups in their home country too .  Jails and prisons dont fix that problem they dont serve to rehabilitate but they do separate such people from the mainstream so that the rest of us can walk down the street and not have to worry about imported violent offenders etc .  Mexicos got social problems .  Somehow the United States ended up in the unenviable position of being expected to help Mexico with their social problems .  Too bad Mexico wont help itself instead theyd rather keep helping themselves to the american taxpayers wallet ....  ,9
who is in the world cup and who will win it ?  i dont follow soccer but im interested BrazilPortugal germanyenglandukrainefranceargentinaitalybrazil probably will win but germany and portugal have a chance ,5
I have been trying to figure out which options newsletter to use for autotrading .?  My dad has gotten me interested in stock options and is willing to contribute 500 a year to me to purchase a options newsletter .   I can match his gift .   But all the option newsletters have so much hype .   I cant figure out which ones are good over the long term .  5 years  .   Any suggestions of option newsletters that have worked for you ??  98 of all options expire worthless the only ones that make money are the sellers so unless the newsletter deals with the selling of options ex call and put writing I would stay away ,6
What are the qualifications on becoming a foster parent ?  and how long is the process ?  My husband and I were put on a list to be foster parents to a nephew of his that is why I am looking for suggestions qualifications or advice from all of you .  Call your local child and family services office the requirements vary by state ..  They usually have classes to become a foster parent .  Good luck .  My husband and I were foster parents for 10 years .  We have adopted two girls that we received as foster children as infants .  ,8
How do i know if a girl likes me ?  i many times find myself looking at a girl from far away or close by and im so attracted to her but usually i just turn around immediately cause i feel like im not worth anything to them .  and sometimes i see girls look at me but generally i dont get any clue on if they like me or not ..  However sometimes i keep looking at her look down or to the side and look at her again and she still is looking at me .. thats when i feel mmmm maybe she likes me .  But i could be wrong .  what do generally girls do when they like someone ?   I am a guy and i dont do nothing if anything i just become shy and turn around ..  and i never smile or if i smile its slight and i dont expect nothing back because i know it usually doesnt happen .  If the girl thinks your cute or nice she will probably flirt with you .  Also if the girl looks at you alot she is probably attracted to you .  If she gets nervous or bashful when you talk to her well then she has a major crush on you ,8
why dont the kids like me ?  I recently started doing magic like david blaine for kids parties .   I have done six so far and no one is impressed and tips are lousy .        The first party I stood on one foot for 3 hours and the kids were board to death .   Then I stayed underwater with a garden hose to breath for the whole 4 hour party .   Once again no takers .   Why dont the kids like my magic when I am bringing Blaine to their houses ?  Ha heh ... thats funny .  ,7
What TV should NOT ...?  have been cancelled ? Brimstone for me ... addicted to cult tv Ooohhh havent thought about that show in a while loved it .   John Glover was an excellent Satan .   Millennium was another I was sorry to see go .  ,7
