Will Batista have a shot at his old title the first night he comes back since he had to give it up ?  No  Batista will get it back at Summer Slam .  Probably from someone other than Rey .  From the looks of it right now Rey will lose the title to possibly Booker T and then Batista gets it back from him .  With the fight BB had earlier this summer WWE would be stupid to waste all that free publicity ,5
Is there a website where kids can learn about all different careers in the world ?  A website where people can post what their job entails how they got the job if they like it  then kids can better decide what to do when they grow up .  The Princeton Reviews website www . princetonreview . com has a very helpful career page however it does require that you register with them for free .   On the homepage click on the college link on the sidebar and then on the majors and careers .   Here you can search or look up various careers and learn about them .   It has great sections like a day in the life facts and figures and a suggested course of study in college .  ,3
What do you do with mail that keeps coming to your apartment addressed to the previous occupants ?  I think they filled out that mail forwarding crap but I keep getting stuff .   Is there a way to tell the post office that those people dont live here any more ?   What does the USPS reccomend ?  Write does not live here on the envelope and leave for the postman ,9
why do girls like hardware boyspokiri ?  Because they hold the stick in their hands .  ,7
how should i ask her out ?  theres a girl that i play badmiton with at a club we are always talking and she often says hi if she sees me at school i really like her but she is in yr 11 and i am in yr 10 i am gonna ask her out but how should i ?  You mean shes a junior and youre a sophmore right ?  If youre only a year apart then go for it  Just try asking her out as a friend first then let it go from there good luck .  ,8
whats your fave tv show ?  AMericas next top model ,7
Anyone checked out permanentenergy . com Al had it on his desk and did nothing now a movie whats with him ?  www . permanentenergy . com shows a pollution free way to make electric power cheaper than any fuel process .  Building these power plants would make millions of high wage jobs and make electric power cheap and over abundant .  Our politions are LOL at our stupidity all the way to the bank That is a complete crock with no basis in science .  ,9
How does Scientist and other Researchers know that the Earth is round ?  Did they just assume the Earth was round or do they have exotic proof ?  If the Earth is round who made this accusation plausable ?  I am curious what your alternate would be . The Earth is not perfectly round but it is round .  ,1
US deliberately provocative ?  When the US is seeking to get Korea not to test a missile what are they doing launching their own first ? this is saber rattling or total ineptitude at best and warmongering at worst . What does it take to get America to act like a leader rather than a dictator or as this event looks a provocateaur ?  The US is defo provocative .  The trouble is I dont think it is deliberate .  They really do think they are doing good things in the world . You cant make peace by waging a war .  ,9
Online red dot clicking thing ... plz help ?  ive been to a couple sites and a few myspace pages and seen this lil red dot that says dont push ... and everytime u push it it says new things ... u can push it up to like 100 times or soemthing ..... anyone know what it is or where to find it or add it to my site .... any know plz help  code to add it to your site is on the page .  ,4
Why is John McCain not a viable candidate ?  They guy seems like a living saint to me and yet he constantly does low in the polls .  Even among Republicans .  Just the fact that he came out of all those years as a POW and was not a dribbling idiot amazes me .  Is there some weird side of him Im not seeing ?  Amnesty ,9
I have a serious problem .   My fingernails and hair do not grow very quickly .    What deficiency  is this ?  Protein ???  ,2
What does deontological mean ?  In ethics deontological ethics or deontology Greek Deon meaning obligation or duty is a theory holding that decisions should be made solely or primarily by considering ones duties and the rights of others .  Deontology posits the existence of a priori moral obligations further suggesting that people ought to live by a set of defined principles that do not change merely as a result of a change in circumstances ie .  situational ethics . One of the most important implications of deontology is that praiseworthy goals can never justify immoral actions in contrast to doctrines that claim the ends justify the means .  Deontology is directly in opposition to consequentialism an ethical theory in which the ends can justify the means because decisions are judged primarily in terms of their consequences .  ,1
Are you for or against war on terrorism ?  why ?  In a recent interview General Norman Schwartzkopf was asked if he  thought there was room for forgiveness toward the people who have  harbored and abetted the terrorists who perpetrated the 911 attacks on  America .    His answer was classic Schwartzkopf .   The General said I believe that forgiving them is Gods function .  OUR  job is to arrange the meeting .  ,9
Which sport is the hardest soccer or soccer ?  i really need to know i have been wondering for the longest time .  THATZ NOT TRUE whoever is at the top of me theres more to it WHY DOESNT HE TRY RUNNING UP AN DOWN A FIELD TRYING TO PUT IT IN A GOAL WHILE PPL R TACKLING U AN IN UR WAY WHILE THE HEAT IS BURNING ON U OR MAYBE RAINING LIK HELL WHILE SLIPING CAUSE THEY WATER THE GRASS BEFORE THEY PLAY THATS A FACT U TRY DAT IM SICK OF THAT GUY DAMN ,5
who is the filipino biologist that presented excellent pioneering researches in biotechnology ?  I think her name was Dr .  Lina Villacarlos ,1
win did president Mirabeu B Lamar move the capital of texas frome houston to austin ?  As far as I could figure out Houston was never the capital of Texas .  Austin was originally settled in 1835 and used to be called Waterloo .  In 1839 Mirabeu B .  Lamar renamed the city to Austin in honor of Stephen F .  Austin the father of Texas who negotiated a peace treaty with the local Indians at the site of the present day Treaty Oak after several settlers were killed in raids .  At the same time the city was also chosen to be the capital of Texas .  ,3
whats the strongest muscle in the human body ?  jaw muscle ,1
why does everyone stare at me ?  because many people react that way when witnessing a paranoid schizophrenic .  ,0
why do pilots use the term May day when the flight is about to crash ?  Hello .   Link a great day  ,3
Never received income tax check from 7 or 8 years ago how do I find it ?  Illinois ?  How do I collect my illinois state tax return from seven or eight years ago ?  I moved to a different address and I never received it . Can I still collect it ?  Im assuming you filed the Tax Return and were expecting a refund .   The Illinois State Treasurers Office has an Unclaimed Property Division where the monies would have went to .   You can search it online at   Yes that is the Illinois Unclaimed Property Website but if you dont feel comfortable taking my word for it you can visit the Illinois State web pages and look for the Treasurers Office and their Unclaimed Property division which will then direct you to  ,6
How can I tell ?  My boyfriend 26 and I 24 have been together for about 6 months now .  In the beginning he was great Hed say and do sweet things for me .  But since we moved in together about a month ago he stopped doing all the sweet nice things he used to do .  How can I tell if something is wrong or if he just thinks since we live together he doesnt need to do all the mushy stuff anymore ?  Ive tried talking to him about it but when I do he quickly says Yes I am happy with you then its end of discussion .  He doesnt want to go any further into the conversation .  I am truely in love with him but I need to know whether or not I should be patient or just assume this relationship was only good while it lasted .  Reality checkLittle one .   This is where you and he find comfort in your relationship .   Youre not dating anymore .   You are a couple .   98 of all men once they get in their comfort zone we relax .   If were right with everything then we start to concentrate on more important stuff like taking care of you and the family we will make .   We are men the providers .   Its in our nature .   We are trained to be .   Is he there with you ?   Does he come home at the same time everyday ?   Are you together on the weekends ?   If you answer no to any of these questions then have concerns . I love my wife and will do whatever it takes to make her happy .   I do still talk silly with her .   I hold her hand open the door for her .   I always tell her I love her .   I will take her anywhere she would like to go .   I dont however buy her flowers everytime we go out .    Once in awhile Ill surprise her . The dating is over and the relationship begins . Good luck .  ,8
Reply High testetorone level ?  m havin erection when  i wake up in the mornin which  as per readed is due to increase in testestororne level n m losinh hair . I want to get rid of Erctions when i wake upPlz let me know methods to reduce Testestoron elevel in the body .  Castration is the most effective way to cut off your testosterone levels but be warned your pants are going to fit funny afterwards .   There once was a man who had three weiners and his pants fit him like a glove but thats another story ... OK seriously whats wrong with morning wood ?   Nothing says IM ALIVE like sporting a fullon chubby .   You should embrace your manhood rather than run from it . As for the Hairloss problem talk to your Doctor about going on Propecia .   Must be prescribed but for most people It really works .   The sooner you start taking it the less hair you will lose .   But understand that it is not cheap and if you ever stop taking it your hair will start falling out again .  ,2
hi give ur best mail group on the net ?  thankx sakarnuyahoo . com ,4
How long will my mouth hurt after root canal ?  I had to go to the dentist this morning because I had toothache he said the tooth was badly decayed and he had to do a root canal on it .  The local anaesthetic has worn off now and its quite painful  not like the terrible toothache I had before more of a dull achey pain .  I know its probably just because of the work that was done on the tooth but how long should I expect it to last for ?  And can I take pain killers for it ?  Whats best to take ?  Call him back and tell him youre in pain .   He should have prescribed something in the first place .   My dentist gave me 800mg Motrin which is basically superstrength Advil .   Itll be achy for 23 days .   He should have instructed you to call him back if it still hurts after a week .   Seriously medical care has dwindled in the last 10 years .   What is UP with doctors forgetting to tell their patients important information like this ?  ,2
how do i find out what years my great grandfather was v . p .  of Prudential ?  Ask him .  ,6
whats the difference between corporate chains and voluntary chains ?  voluntary chains are independent ownership retailers like true value hardware and ACE hardware and corporate chains are common ownership chains like PUBLIX or FOOD LION ,6
What is schoollike ?  How do people get along in school a educational center ,3
What happens when you call a 1900 sex hotline ?  My boyfriends sister told me he used to call them all the time and I am just curious as to what they say to you .  I just dont get the excitement why not just watch a porn ?  the appeal of these numbers over porn is you are interacting with a live person .  Now granted you cant see the person and she may weigh 400 lbs .  or may even be a man .  YIKES  But most men have a vivid imagination and to them they are speaking to a beautiful woman who is going to fullfill a fantasy .  ,8
will neosporen work on shaving bumps ??  on my pubix area ????  buy tend skin in a blue bottle at the beauty supply and try waxing next time ,2
My boyfriend left today for 2 weeks and didnt tell me .  WHY ??  my boyfriend is leaving today and he is gonna be gone for 2 weeks and he didnt tell me he had his best friend do it .  WHY Hes probably pretty young and insecure with his emotions .   Its difficult for men let alone YOUNG men to express their emotions .   Hes probably feeling like hes abandoning you and somewhat uncomfortable about the whole situation .    Remeber men and women are different not just physically but they way they process information ALL information .   Give him a break .   If he loves you hell come back if not then it didnt matter to begin with .   SlainteD ,8
Why did i start my menstrual cycle twice this month ?  I started my cycle twice this month the first time i bleed normal and second time i started for one day only Dont worry about it if you get stressed or very upset it can sometimes mess with your menstrual cycle .  If your taking the pill or any other contraception which aims at controlling your hormones this too can affect your cycle .  If you really are worried i would just go to the doctor to be on the safe side and to put your mind at ease .  ,2
could i use both avast and avg to protect my computer ?  why do you want to use both when both wouldbe doing the same thing and even using both at the same time would slow down ur system i recommed free versionof avg for home usersthanks ,4
I am getting e mail from a person I do not know it is a hotmail acc .  not bad ones ... how do I find who it is ?  ,4
Abortion on Demand ?  Many people who oppose abortion or who only weakly support abortion rights will often focus their objections on the idea of abortion on demand .  They see something wrong with abortion being readily available .  But if abortion is not available on demand what is the point of it being legal ?  i am very prochoice and believe that any woman anywhere anytime should be able to get an abortion .  finally someone who agrees with me  ,9
Whats the outlook for our southwest  monsoon season this year .?  Can we expect some decent rains in July Aug and Sept ?  This drought map sure indicates it is needed this year .  This is an edu link so maybe there are forecasts available as well .  ,1
Do you think england is going to win the world cup ?  If you look at the rating on a lot of websites soccernet . com included England is rated second best to lift this cup .  And like i have said in the history of this competition only in 1958  1962 did Brazil take it consecutively it has never happened again after then  and i dont expect it to happen again now .  If history repeats itself then its Europes turn to take the cup and England is favorite to lift it among the European teams so i think they can win it .  ,5
which former raider made the worst hit on a player in football history ?  the quaterback was really asking for his mom and wouldn let go of the ball A close tie to Romo and Tatum ,5
My best friend of Seven Years Just stopped talking to me ?  We have been close friends talked about everything and anything .  We both were single moms hanging out taking our kids every where together they were extremely close .  Then she decided to hook me up with her brother so were dating and all hanging out and then she started saying things like I dont think he wants me and the kids around I tried to tell her it wasnt like that .  Now we havent talked in months .  I asked her brother to take care of this because I feel like it wasnt me what should I do ?  any suggestions Try talking to her and finding out the real reason she hasnt been hanging around .   Youre right it probably has nothing to do with you .   It sounds like shes jealous of the time that you and her brother spend together and feels left out .   Try to include her more and set aside special time for you and her .   So many people neglect their friends for a relationship and it should never be like that .   She may be jealous that you found someone and shes still single .   The only way to find out is to talk to her and keep trying to talk to her .   If your kids are close and you and her brother have a future youre going to be in her life for awhile whether she likes it or not and hopefully you can find a way to peacefully coexist .  ,8
how i can sell furniture on line ?  Ebay is the way to go ,6
what happened if ethiopia goes to world cup ?  Ethiopia together with Kenya is known for the worlds best marathon runners ... So figure out yourself after 90 minutes 22 legs would still be running without a break but no goal would be scored P ,5
what is th big turn on  ? for males and females ?  A pretty facea tight rearand a nice chestor a nice pair of legs . any of these will do for me .  ,8
Does anyone who how to choose the shoe size for adidas football soccer boots ???  wel im thinking of buying a F50 . 6 or a predictor absolute ...  but i dont know how to choose my size ..  becoz when i want the correct length it is bout uk8 . 5 butits bit unconfotable on the sides .  so i change to uk 9 . 5 but now this time there is bout 1 . 5 cm emptyspase in the fron of the boots ...  which one should i buy ...  also can u reconment me which soccer boots is best to buy now ... there is only pumanikeadidasumbro roun my place ..  Why dont you try a 9 . 0 then ?  Boots must ALWAYS be comfortable no matter what .  So dont ever get the 8 . 5 and if youre growing pretty fast you might want to get the 9 . 5 otherwise dont . As for boots it depends on the type of surface you are playing on i . e .  court field or turf as well as what you need your boots to do for you .  Remember your boots serve you so choose one that serves your needs .  For instance if youre the playmaker and need to spray the passes then go for a pair that allows maximum grip and control . I havent been keeping in touch with the latest boots so I guess you might want to go get a pair with a more experienced buyer .  ,5
My boys have what our dr said was eczema .?  they have it on their hands and feet .  they get what look like blisters they pop open and dry up .  it can be very itchy .  What do you think it is or does anyone have similar symptoms ?   what is best to treat this ?  There are several types of eczema .  I have the type you describe on your sons hands and feet .  Moisturize at least twice a day with a nonscented cream not lotion like Eucerin or Cetaphil or a generic equivalent . Provide them with a mild cleansing bar such as Dove sensitive for bathing and hand washing .  Most people with eczema are very sensitive to chemicals so apply their sunscreen and such yourself avoiding the areas with eczema .  They should avoid exposing the affected areas to very hot water as it makes the itch unbearable . Childrens Benadryl orally can help with severe itching and eczema can cause really severe itching but it may make them sleepy .  Running cool water over the affected area helps a lot .  I have not found that topical Benadryl creams help much .  Aveeno oatmeal products are highly recommended but they dont help me .  Theyre worth a try though .  Actually the cool water helps more than anything but it stops working when the area warms up again . Over the counter cortisone creams may treat the rash but their doc may need to prescribe something stronger .  And Im not sure theyre recommended for children .  They shouldnt wash dishes without gloves or mess around in other chemicals when they are having a flare up . Many kids outgrow eczema .  Unfortunately we dont all poutEDITI almost forgot Sunshine not too much of course helps many eczema sufferers .  Expose the affected area for 1015 minutes a day .  Im kinda weird about getting too hot but many people get quite a bit of relief from sunshine .  Again its worth a try .  ,2
how do i get my picture id if the rmv registry of motor vehicleis giving me such a hard time ?  the reason why i waited soo long to get my id was because i moved out from my parents since i was 16 .  i try going to the rmv to get it at the time but they needed a certified birth certificate .  i didnt have one at the time .  i had the one given to at birth .  im a u . s citizen  since they were giving me such a hard time then i gave up .  now 4 years later i wanted to go back and get my license but yet they were still giving me a hard time . the law change cuz of all the immigration system so i said fine im trying to get a picture id .  they wanted for forms of id i  finally had my certified birth certificate my s . s as well as my bill but the one thing i didnt have is a signature .  what should i do ???  i mess up everything for my self .  They arent giving you a hard time .   They have specific requirements that are probably spelled out in many of their publications and everyone applying for a licensephoto ID needs to abide by the same rules .   Do you have a Voter Registration card ?   Are you 18 at least ?   Register to vote .   Its a free process and you sign your card and it is proof of residency .   You can pick up a Voter Registration application at most US Post Offices libraries or contact the voter registration office in your town . You might think about applying for a US Passport .   You submit your passport application along with a copy of your birth certificate and 2 identical photographs .   A passport is a very valid form of ID and can give you that proof you need to get other forms of ID .   You will need 2 forms of ID when you are hired for jobs in the US too .   Last time I had my passport renewed it was about 50 and it is good for 10 years but it can be used for ID even after it expires .   You can pick up a passport application at many Post Office locations or the process is probably available online by now .  ,9
Isnt Hell a Satanists Heaven ??  It makes sense to me that a Satanist wouldnt be botheredworried that he is not going to Heaven .  After all they worship Satan and he is the Lord of Hell ... hot cabana boys and girls at one hot party Sounds like Heaven for them to me . Woo Hoo Hell is quite painful apparently .  I would not want to go to neither of them heaven or hell . Its like switching off your computer .  All processes just stop . And you dont write philosophy books on Where does PC consciousness go after switching off ?  Do you ?  Dont think so .  ,0
Did anyone see Superman Returns in the IMAX Last Night ?  I went to see superman last night in NYC at the Imax was anyone there and what did u think of the movie ?  I saw it for free last saturday . Its coolbecause where I live we have nothing to do .  literally and they get us free movies that are unreeased .  ,7
Sound installation ?  My mother board is asus P4SDLA .  Ihave to install the sound drive . I dont have the mother board CD .  Then where can i get the software for sound installation .  Just go to the Manufacturers website and download it ... piece of cakeMotherboard Specs note that they use this board in many of their computers HP you should enter the name of your computer to download the entire driver kit ... the board just uses the AC97 sound so that part easy .. you should have the others on hand .  ,4
Can I get a prosecutor fired for being unprofessional and not acting p . c .?  I had to go to court today and got some unfortuate news which at was not as bad as I thought .  I got pulled over last December because I wasnt wearing a seat belt hello I was going through a check point Shouldnt they be worried about drunks ?  And I was late paying my car insurance by three weeks and my insurance company called the bmv and told them I was late so they suspended my licsense I renewed my licsense that night and went downtown and paid a 200 reinstatement fee then I went to court and  paid 260 in court costs .  As far as I knew I had my liscense back and everything was cool .  Then in March I was really upset because a family member owed me money and he said he would bring it over never came over and wasnt picking up his phone .  Furious I drove to his house and was going about 65 in a 40 on an inconspicous country road .  A cop coming the oppisite direction sees me and turns around and pulls me over .  He comes back and tells me my licsense is suspended I guess even contact the board of attorneys you could explain your case and even get his license revoked .   I would call info to get the number since it varies per state ,9
is there  any showroom for suzuki hayabushabike in india ?  bike Yes these is a showroom in Banglore called Joes Automobiles they deliver Busa at your doorstep .  ,5
can u read this ?  gasoline rates go up from today we all no that ,8
Why does the DEA and AMA allow tobacco companies to continue to put nicotine in cigarettes ?  Its obvious and has been for years that the most lethally addicting substance available is cigarettes .   But tobacco doesnt have any addicting ingredients cigarette companies ADD nicotine to get consumers addicted .   Why in the world is there a war on drugs when the most heinous drug is allowed everywhere ?  Because the government can profit from tobacco sales and people want to smoke regardless of the health effects .  The war on some drugs is just a repeat of prohibition .  Its never going to succeed .  ,9
do you believe our deceased love ones are always near spiritually ?  do they try to contact us ?  No .  ,0
does it really help doing all these new couses bbi bfa as compared to a simple b com  ?  Absolutely B . com is for kids ,3
